850,globalmar_202005_02_MAR_influentsource.fid--6d6ccaee_171ff1a6a80_1be6,396,Verdun-sur-Garonne,Europe,France,43.85389,1.236389,1976,-9999,Spreading Methods,Infiltration basin,<a href='https://inowas.com/mar-methods/infiltration-ponds-and-basins/' target='_blank'>Infiltration ponds</a> (<a href='https://inowas.com/mar-methods/soil-aquifer-treatment-sat/' target='_blank'>SAT</a>),River water,Domestic,Water Quality Management,"<a href='http://infoterre.brgm.fr/rapports/RP-61821-FR.pdf' target='_blank'>Casanova J., Cagnimel M., Devau N., Pettenati M., Stollsteiner Ph. (2012)  Recharge artificielle des eaux souterraines : état de l’art et perspectives. Rapport final. BRGM/RP-",1.236389 43.85389,43.85389,1.236389,365.2739868
851,globalmar_202005_02_MAR_influentsource.fid--6d6ccaee_171ff1a6a80_1be7,304,Shitoro,Asia,Japan,34.841013,138.1081,1989,-9999,In-Channel Modification,Subsurface Dam,<a href='https://inowas.com/mar-methods/subsurface-dams/' target='_blank'>Subsurface dams</a>,Groundwater,no data,no data,"<a href='https://www.jstage.jst.go.jp/article/jarq/45/1/45_1_51/_pdf/-char/en' target='_blank'>Ishida, S., T. Tsuchihara, S. Yoshimoto, and M. Imaizumi. 2011. Review: Sustainable Use of Groundwater with Underground Dams. JARQ 45 (1): 51 – 61.</a>",138.1081 34.841013,0,0,1042.994629
852,globalmar_202005_02_MAR_influentsource.fid--6d6ccaee_171ff1a6a80_1be8,782,Fazenda Sítio Manoel,South America,Brasil,-6.524552,-36.373584,-9999,-9999,In-Channel Modification,Subsurface Dam,<a href='https://inowas.com/mar-methods/subsurface-dams/' target='_blank'>Subsurface dams</a>,River water,Agricultural,Maximize Natural Storage,"<a href='http://www.aba-agroecologia.org.br/revistas/index.php/rbagroecologia/article/view/9304' target='_blank'>da Silva, M. S. L., M. B. de O. Neto, G. B. Ferreira, R. da B. V. Parahyba, T. J. F. Cunha, and V. C. Chaves. 2009. Caracterização do solo",-42.898136,0,0,104.8533325
853,globalmar_202005_02_MAR_influentsource.fid--6d6ccaee_171ff1a6a80_1be9,1079,Oak Creek,North America,USA,42.874693,-87.92191,2004,2011,"Well, Shaft and Borehole Recharge",Aquifer storage and recovery,<a href='https://inowas.com/mar-methods/aquifer-storage-and-recovery-asr/' target='_blank'>ASR</a>/<a href='https://inowas.com/mar-methods/aquifer-storage-transfer-and-recovery-astr/' target='_blank'>ASTR</a>,Lake water,no data,Maximize Natural Storage,"<a href='http://www.asrforum.com/picturepages/OperASRUS052404.pdf' target='_blank'>Pyne, R. D. G. 2004. Known Operating ASR Systems in the United States (as of May 2004). ASR Systems LLC. http://www.asrforum.com/picturepages/OperASRUS052404.pdf</a>",-87.92191 42.874693,42.874693,-87.92191,633.1480103
854,globalmar_202005_02_MAR_influentsource.fid--6d6ccaee_171ff1a6a80_1bea,255,Surya Vihar Appartments,Asia,India,28.517881,77.077429,2004,-9999,Rainwater and Run-off Harvesting,Rooftop Rainwater Harvesting,<a href='https://inowas.com/mar-methods/rooftop-rainwater-harvesting/' target='_blank'>Rooftop rainwater harvesting</a>,Storm water,Domestic,Maximize Natural Storage,"<a href='http://www.cseindia.org/surya-vihar-appartments-1993' target='_blank'>Centre for Science and Environment - CSE. 2014. Surya Vihar Appartments. Urban Rainwaterharvesting. http://www.cseindia.org/surya-vihar-appartments-1993 (accessed September 1,",77.077429 28.517881,28.517881,77.077429,261.2086792
855,globalmar_202005_02_MAR_influentsource.fid--6d6ccaee_171ff1a6a80_1beb,739,Lower Flagstone Creek Weir  (Lockyer Valley),Oceania,Australia,-27.592346,152.142102,-9999,-9999,In-Channel Modification,Check dam,<a href='https://inowas.com/mar-methods/recharge-dams/' target='_blank'>Recharge dams</a>,River water,Ecological,Maximize Natural Storage,<a href='https://qldgov.softlinkhosting.com.au/liberty/opac/search.do?mode=BASIC&corporation=DERM&limit=All&action=search&anonymous=true&queryTerm=Soils+and+irrigated+land+suitability+of+the+Lockyer+Valley+alluvial+plains%2C+South-East+Queensland&resourc,152.142102 -27.592346,0,0,115.9300003
856,globalmar_202005_02_MAR_influentsource.fid--6d6ccaee_171ff1a6a80_1bec,326,Al Ansab,Asia,Oman,23.548235,58.343948,1993,-9999,In-Channel Modification,Check dam,<a href='https://inowas.com/mar-methods/recharge-dams/' target='_blank'>Recharge dams</a>,River water,Agricultural,Physical Aquifer Management,"Abdalla, O. A. E., and A. S. Al-Rawahi. 2013. Groundwater Recharge Dams in Arid Areas as Tools for Aquifer Replenishment and Mitigating Seawater Intrusion: Example of AlKhod, Oman. Environmental Earth Sciences 69 (6): 1951–1962. doi:10.1007/s12665-012-",58.343948 23.548235,23.548235,58.343948,
857,globalmar_202005_02_MAR_influentsource.fid--6d6ccaee_171ff1a6a80_1bed,26,Atlantis Water Resource Management Scheme (AWRMS),Africa,South Africa,-33.628087,18.449092,1994,-9999,Spreading Methods,Infiltration basin,<a href='https://inowas.com/mar-methods/infiltration-ponds-and-basins/' target='_blank'>Infiltration ponds</a> (<a href='https://inowas.com/mar-methods/soil-aquifer-treatment-sat/' target='_blank'>SAT</a>),Reclaimed wastewater,Domestic,Maximize Natural Storage,"<a href='www.artificialrecharge.co.za/casestudies/Atlantis_final_10August2010.pdf' target='_blank'>Tredoux, G., and J. Cain. 2010. The Atlantis Water Resource Management Scheme: 30 Years of Artificial Groundwater Recharge. P RSA 000/00/11609/10 - Activit",18.449092 -33.628087,-33.628087,18.449092,202.9900055
858,globalmar_202005_02_MAR_influentsource.fid--6d6ccaee_171ff1a6a80_1bee,324,Kampung Jenderam Hilir – well No. 2,Asia,Malaysia,2.89234,101.720818,2001,-9999,Induced Bank Filtration,Bank filtration,<a href='https://inowas.com/mar-methods/induced-bank-filtration/' target='_blank'>River/lake bank filtration</a><br><a href='https://inowas.com/mar-methods/dune-filtration/' target='_blank'>Dune filtration</a>,River water,Agricultural,Water Quality Management,"Shamsuddin, M. K. N., W. N. A. Sulaiman, S. Suratman, M. P. Zakaria, and K. Samuding. 2014. Groundwater and Surface-Water Utilisation Using a Bank Infiltration Technique in Malaysia. Hydrogeology Journal 22 (3): 543–564. doi:10.1007/s10040-014-1122-4.",101.720818 2.89234,0,0,1169.831299
859,globalmar_202005_02_MAR_influentsource.fid--6d6ccaee_171ff1a6a80_1bef,638,Comarca Lagunera,North America,Mexico,25.55,-103.433333,1991,-9999,Spreading Methods,Infiltration basin,<a href='https://inowas.com/mar-methods/infiltration-ponds-and-basins/' target='_blank'>Infiltration ponds</a> (<a href='https://inowas.com/mar-methods/soil-aquifer-treatment-sat/' target='_blank'>SAT</a>),Lake water,Agricultural,Physical Aquifer Management,"Lara, F. 2003. Feasibility Study for Artificial Aquifer Recharge at the Comarca Lagunera Aquifer, Coahuila, Mexico. In 11th Biennial Symposium on the Groundwater Recharge, Phoenix, AZ, June 5-7, 2003. Phoenix, AZ: Arizona Hydrological Society, Arizona De",-103.433333 25.55,0,0,80.95800018
860,globalmar_202005_02_MAR_influentsource.fid--6d6ccaee_171ff1a6a80_1bf0,612,Södertälje,Europe,Sweden,59.195,17.625,-9999,-9999,Spreading Methods,Infiltration basin,<a href='https://inowas.com/mar-methods/infiltration-ponds-and-basins/' target='_blank'>Infiltration ponds</a> (<a href='https://inowas.com/mar-methods/soil-aquifer-treatment-sat/' target='_blank'>SAT</a>),Lake water,Domestic,no data,"Bowen, H., 1986. Groundwater. Elsevier applied Science Publishers.",17.625 59.195,59.195,17.625,
861,globalmar_202005_02_MAR_influentsource.fid--6d6ccaee_171ff1a6a80_1bf1,132,Xian,Asia,China,34.322784,108.931544,2002,-9999,"Well, Shaft and Borehole Recharge",Aquifer storage using wells,<a href='https://inowas.com/mar-methods/shallow-wells-shafts-and-pits-infiltration/' target='_blank'>Shallow well/shaft/pit infiltration</a>,River water,Domestic,Physical Aquifer Management,"Hao, J. 2011. Divide of Groundwater Overdraft zone and analysis of Ecological Restoration in Xi’an (in Chinese: 西安市地下水超采区划分及生态修复量研究).",108.931544 34.322784,0,0,117.6320038
862,globalmar_202005_02_MAR_influentsource.fid--6d6ccaee_171ff1a6a80_1bf2,1086,Westbrook Ave. ASR Site,North America,USA,34.22335,-77.833933,-9999,-9999,"Well, Shaft and Borehole Recharge",Aquifer storage and recovery,<a href='https://inowas.com/mar-methods/aquifer-storage-and-recovery-asr/' target='_blank'>ASR</a>/<a href='https://inowas.com/mar-methods/aquifer-storage-transfer-and-recovery-astr/' target='_blank'>ASTR</a>,no data,no data,no data,"Pyne, R. D. G. 2007. Overview of Aquifer Storage Recovery in the USA and the World. Presentation presented at the Conference on Aquifer Storage Recovery and Artificial Recharge in Oregon, “Overcoming Technical, Regulatory and Social Challenges,” Nove",-77.833933 34.22335,34.22335,-77.833933,478.1019897
863,globalmar_202005_02_MAR_influentsource.fid--6d6ccaee_171ff1a6a80_1bf3,300,Rokugo basin 2,Asia,Japan,39.416667,140.568056,-9999,-9999,Spreading Methods,Infiltration basin,<a href='https://inowas.com/mar-methods/infiltration-ponds-and-basins/' target='_blank'>Infiltration ponds</a> (<a href='https://inowas.com/mar-methods/soil-aquifer-treatment-sat/' target='_blank'>SAT</a>),River water,no data,Physical Aquifer Management,"Hida, N., and M. Kagabu. 2009. Managed Aquifer Recharge (MAR): The Relationship between Surface Water Temperature in Recharge Basin and Groundwater Temperature-The Case of the Rokugo Alluvial Fan, in Northern Japan. Journal of Japanese Association of Hyd",140.568056 39.416667,0,0,1042.994629
864,globalmar_202005_02_MAR_influentsource.fid--6d6ccaee_171ff1a6a80_1bf4,155,Qingfeng Farm,Asia,China,45.786947,133.072354,2000,-9999,"Well, Shaft and Borehole Recharge",Aquifer storage and recovery,<a href='https://inowas.com/mar-methods/aquifer-storage-and-recovery-asr/' target='_blank'>ASR</a>/<a href='https://inowas.com/mar-methods/aquifer-storage-transfer-and-recovery-astr/' target='_blank'>ASTR</a>,Storm water,Agricultural,Maximize Natural Storage,"Wang, B., W. Zhao, J. Chen, and Z.-C. Yao. 2004. Methods of Artificial Recharge of groundwater in Sanjiang Plain (in Chinese: 三江平原人工回灌地下水的有效途径与方法). Water Conservancy Science and Technology and Economy 10 (2): 74–75",133.072354 45.786947,0,0,148.1473389
865,globalmar_202005_02_MAR_influentsource.fid--6d6ccaee_171ff1a6a80_1bf5,1053,United Water,North America,USA,43.576807,-116.283314,-9999,-9999,"Well, Shaft and Borehole Recharge",Aquifer storage and recovery,<a href='https://inowas.com/mar-methods/aquifer-storage-and-recovery-asr/' target='_blank'>ASR</a>/<a href='https://inowas.com/mar-methods/aquifer-storage-transfer-and-recovery-astr/' target='_blank'>ASTR</a>,no data,no data,no data,"<a href='http://www.asrforum.com/picturepages/OperASRUS052404.pdf' target='_blank'>Pyne, R. D. G. 2004. Known Operating ASR Systems in the United States (as of May 2004). ASR Systems LLC. http://www.asrforum.com/picturepages/OperASRUS052404.pdf</a>",-116.283314 43.576807,0,0,81.44599915
866,globalmar_202005_02_MAR_influentsource.fid--6d6ccaee_171ff1a6a80_1bf6,929,Redmond ASR,North America,USA,47.677008,-122.10887,-9999,-9999,"Well, Shaft and Borehole Recharge",Aquifer storage and recovery,<a href='https://inowas.com/mar-methods/aquifer-storage-and-recovery-asr/' target='_blank'>ASR</a>/<a href='https://inowas.com/mar-methods/aquifer-storage-transfer-and-recovery-astr/' target='_blank'>ASTR</a>,no data,no data,no data,"<a href='http://faculty.washington.edu/dersh/Files/Project2009/Aquifer_Presentation.pdf' target='_blank'>Arvan, H., M. Golubovskiy, and K. Wood. 2009. Aquifer Storage and Recovery in Washington. Presentation Washington, D.C. faculty.washington.edu/dersh/",-122.10887 47.677008,0,0,1097.702026
867,globalmar_202005_02_MAR_influentsource.fid--6d6ccaee_171ff1a6a80_1bf7,1335,Agon-Coutainville,Europe,France,49.05527778,-1.59444444,2003,-9999,Spreading Methods,Infiltration basin,<a href='https://inowas.com/mar-methods/infiltration-ponds-and-basins/' target='_blank'>Infiltration ponds</a> (<a href='https://inowas.com/mar-methods/soil-aquifer-treatment-sat/' target='_blank'>SAT</a>),Reclaimed wastewater,Environmental,Water Quality Management,<a href='http://aquanes.eu/Default.aspx?t=1661' target='_blank'>http://aquanes.eu/Default.aspx?t=1661</a>,-1.59444444 49.05527778,49.05527778,-1.59444444,489.4086609
868,globalmar_202005_02_MAR_influentsource.fid--6d6ccaee_171ff1a6a80_1bf8,888,Springtree – City of Sunrise ASR System,North America,USA,26.1758333,-80.2611111,-9999,-9999,"Well, Shaft and Borehole Recharge",Aquifer storage and recovery,<a href='https://inowas.com/mar-methods/aquifer-storage-and-recovery-asr/' target='_blank'>ASR</a>/<a href='https://inowas.com/mar-methods/aquifer-storage-transfer-and-recovery-astr/' target='_blank'>ASTR</a>,no data,no data,no data,"Mirecki, J. E. 2004. Water-Quality Changes During Cycle Tests at Aquifer Storage Recovery (ASR) Systems of South Florida. ERDC/EL TR-04-8. Vicksburg, MS, USA: Environmental Laboratory, U.S. Army Engineer Research and Development Center.",-80.2611111 26.1758333,26.1758333,-80.2611111,413.2106628
869,globalmar_202005_02_MAR_influentsource.fid--6d6ccaee_171ff1a6a80_1bf9,646,Cuenca del Río Sonora,North America,Mexico,29.068506,-110.954286,2010,-9999,Spreading Methods,Infiltration basin,<a href='https://inowas.com/mar-methods/infiltration-ponds-and-basins/' target='_blank'>Infiltration ponds</a> (<a href='https://inowas.com/mar-methods/soil-aquifer-treatment-sat/' target='_blank'>SAT</a>),Reclaimed wastewater,Domestic,Water Quality Management,"Mendoza Mata, A., A. Palma Nava, and F. J. González Villareal. 2012. Anteproyecto de recarga artificial de acuíferos en la cuenca del Río Sonora. In XXII Congreso Nacional de Hidráulica. Acapulco, Mexico: AMH.",-110.954286 29.068506,0,0,54.56800079
870,globalmar_202005_02_MAR_influentsource.fid--6d6ccaee_171ff1a6a80_1bfa,1118,"Federal Savings & Loan Association Building - 27G1,2",North America,USA,45.630385,-122.670789,-9999,-9999,"Well, Shaft and Borehole Recharge",Aquifer storage and recovery,<a href='https://inowas.com/mar-methods/aquifer-storage-and-recovery-asr/' target='_blank'>ASR</a>/<a href='https://inowas.com/mar-methods/aquifer-storage-transfer-and-recovery-astr/' target='_blank'>ASTR</a>,Groundwater,Industrial,Other Benefits,"<a href='http://pubs.er.usgs.gov/publication/wsp1594C?currow=684.' target='_blank'>Price, D., D. H. Hart, and B. L. Foxworthy. 1965. Artificial Recharge in Oregon and Washington 1962. 1594-C. Water Supply Paper. U.S. Geological Survey. http://pubs.er.usg",-122.670789 45.630385,0,0,841.6246948
871,globalmar_202005_02_MAR_influentsource.fid--6d6ccaee_171ff1a6a80_1bfb,645,Valles Centrales de Oaxaca,North America,Mexico,16.964935,-96.578188,2004,-9999,In-Channel Modification,Channel infiltration/spreading,<a href='https://inowas.com/mar-methods/channel-spreading/' target='_blank'>Channel spreading</a>,River water,Domestic,Physical Aquifer Management,"Aragón Sulik, M. D., V. J. Morales Domínguez, and T. Caballero Aquino. 2006. Sistema para la recarga del manto freático en una comunidad del Distrito de Tlacolula, Oaxaca, México. Naturaleza y Desarrollo 4 (2): 17–22.",-96.578188 16.964935,0,0,721.4573364
872,globalmar_202005_02_MAR_influentsource.fid--6d6ccaee_171ff1a6a80_1bfc,755,Aquífero Cauê – Área de influência Fechos Auxiliar,South America,Brasil,-7.78,-60.9,-9999,-9999,Spreading Methods,Infiltration basin,<a href='https://inowas.com/mar-methods/infiltration-ponds-and-basins/' target='_blank'>Infiltration ponds</a> (<a href='https://inowas.com/mar-methods/soil-aquifer-treatment-sat/' target='_blank'>SAT</a>),Storm water,Ecological,Maximize Natural Storage,"<a href='https://aguassubterraneas.abas.org/asubterraneas/article/view/27614/17871' target='_blank'>Bertachini, M. N., A. C. Bertachini, B. A. Pereira, C. A. P. Grandchamp, F. S. Nunes, and M. P. Filho. 2012. Estudos sobre os efeitos da Recarga Artificia",-68.68,0,0,852.8339844
873,globalmar_202005_02_MAR_influentsource.fid--6d6ccaee_171ff1a6a80_1bfd,497,Culemborg,Europe,Netherlands,51.948,5.233,1911,-9999,Induced Bank Filtration,Bank filtration,<a href='https://inowas.com/mar-methods/induced-bank-filtration/' target='_blank'>River/lake bank filtration</a><br><a href='https://inowas.com/mar-methods/dune-filtration/' target='_blank'>Dune filtration</a>,River water,Domestic,Water Quality Management,"Stuyfzand, P.J., Doomen, A., 2004. The Dutch experience with MARS (Managed Aquifer Recharge and Storage) - A review of facilities, techniques and tools.",5.233 51.948,51.948,5.233,
874,globalmar_202005_02_MAR_influentsource.fid--6d6ccaee_171ff1a6a80_1bfe,421,Mündelheim,Europe,Germany,51.369,6.688,-9999,-9999,Induced Bank Filtration,Bank filtration,<a href='https://inowas.com/mar-methods/induced-bank-filtration/' target='_blank'>River/lake bank filtration</a><br><a href='https://inowas.com/mar-methods/dune-filtration/' target='_blank'>Dune filtration</a>,River water,Domestic,Water Quality Management,"Furrer, R., Fleig, M., Brauch, H.J., 2000. Wasserförderung und -aufbereitung im Rheineinzugsgebiet. Rheinthemen 2.",6.688 51.369,51.369,6.688,477.6199951
875,globalmar_202005_02_MAR_influentsource.fid--6d6ccaee_171ff1a6a80_1bff,117,"Fengtai, Peking",Asia,China,39.829667,116.248785,1995,-9999,Spreading Methods,Surface flooding and ditch-and-furrow,<a href='https://inowas.com/mar-methods/ditches-and-furrows/' target='_blank'>Ditches and furrows</a>,River water,Domestic,Physical Aquifer Management,***. 1996. Significant effect  in groundwater recharge in Yongding River  (in Chinese: 永定河沿岸地下水回灌效果显著).,116.248785 39.829667,0,0,81.98867035
876,globalmar_202005_02_MAR_influentsource.fid--6d6ccaee_171ff1a6a80_1c00,211,Har Ki Pauri,Asia,India,29.961269,78.175776,2004,-9999,Induced Bank Filtration,Bank filtration,<a href='https://inowas.com/mar-methods/induced-bank-filtration/' target='_blank'>River/lake bank filtration</a><br><a href='https://inowas.com/mar-methods/dune-filtration/' target='_blank'>Dune filtration</a>,River water,Domestic,Water Quality Management,"Dash, R. R., E. V. P. Bhanu Prakash, P. Kumar, I. Mehrotra, C. Sandhu, and T. Grischek. 2010. River Bank Filtration in Haridwar, India: Removal of Turbidity, Organics and Bacteria. Hydrogeology Journal 18 (4): 973–983. doi:10.1007/s10040-010-0574-4.",78.175776 29.961269,29.961269,78.175776,522.0373535
877,globalmar_202005_02_MAR_influentsource.fid--6d6ccaee_171ff1a6a80_1c01,165,Jinlang Shangquan,Asia,China,41.775012,123.440514,2013,-9999,"Well, Shaft and Borehole Recharge",Aquifer storage using wells,<a href='https://inowas.com/mar-methods/shallow-wells-shafts-and-pits-infiltration/' target='_blank'>Shallow well/shaft/pit infiltration</a>,River water,Ecological,Other Benefits,"Liu, J., and W. Dai. 2013. Reserch on Attenuation Characteristic of Recharge During Pressure Recharge (in Chinese: 压力回灌中回灌量衰减因素探讨). Economic Irrigation 8: 52–59. doi:1007-4929(2013)08-0052-02.",123.440514 41.775012,0,0,316.8080139
878,globalmar_202005_02_MAR_influentsource.fid--6d6ccaee_171ff1a6a80_1c02,1049,Ankeny ASR,North America,USA,41.729115,-93.610611,-9999,-9999,"Well, Shaft and Borehole Recharge",Aquifer storage and recovery,<a href='https://inowas.com/mar-methods/aquifer-storage-and-recovery-asr/' target='_blank'>ASR</a>/<a href='https://inowas.com/mar-methods/aquifer-storage-transfer-and-recovery-astr/' target='_blank'>ASTR</a>,Tap water,no data,Maximize Natural Storage,"<a href='http://www.asrforum.com/picturepages/OperASRUS052404.pdf' target='_blank'>Pyne, R. D. G. 2004. Known Operating ASR Systems in the United States (as of May 2004). ASR Systems LLC. http://www.asrforum.com/picturepages/OperASRUS052404.pdf</a>",-93.610611 41.729115,0,0,403.9719849
879,globalmar_202005_02_MAR_influentsource.fid--6d6ccaee_171ff1a6a80_1c03,728,Kroombit Dam (Callide Valley),Oceania,Australia,-24.417232,150.772157,1992,-9999,In-Channel Modification,Channel infiltration/spreading,<a href='https://inowas.com/mar-methods/channel-spreading/' target='_blank'>Channel spreading</a>,River water,Agricultural,Maximize Natural Storage,"Redlich, H. 2011. Submissions On Behalf Of Sunwater Limited (And Burnett Water Pty Ltd). SNWQ.001.001.0005. Brisbane: Queensland floods commission of inquiry. www.floodcommission.qld.gov.au/__data/assets/file/0005/5954/Sunwater_and_Burnett_Water.pdf.",150.772157 -24.417232,0,0,158.9266663
880,globalmar_202005_02_MAR_influentsource.fid--6d6ccaee_171ff1a6a80_1c04,1339,La Mitidja Legros System,Africa,Algeria,36.585054,2.883073,2000,-9999,Spreading Methods,Infiltration basin,<a href='https://inowas.com/mar-methods/infiltration-ponds-and-basins/' target='_blank'>Infiltration ponds</a> (<a href='https://inowas.com/mar-methods/soil-aquifer-treatment-sat/' target='_blank'>SAT</a>),River water,Agricultural,no data,ANRH 2012,2.883073 36.585054,36.585054,2.883073,231.8580017
881,globalmar_202005_02_MAR_influentsource.fid--6d6ccaee_171ff1a6a80_1c05,1337,Oued Biskra,Africa,Algeria,34.89222222,5.7425,-9999,-9999,Spreading Methods,Check dam,<a href='https://inowas.com/mar-methods/recharge-dams/' target='_blank'>Recharge dams</a>,River water,Agricultural,no data,ANRH 2012,5.7425 34.89222222,34.89222222,5.7425,54.51933289
882,globalmar_202005_02_MAR_influentsource.fid--6d6ccaee_171ff1a6a80_1c06,403,Stolpe,Europe,Germany,52.66,13.26,1911,-9999,Spreading Methods,Surface flooding and ditch-and-furrow,<a href='https://inowas.com/mar-methods/flooding/' target='_blank'>Flooding</a>,River water,Domestic,Water Quality Management,"<a href='https://www.berlin.de/senuvk/umwelt/wasser/download/wvk2040.pdf' target='_blank'>Möller, K., Burgschweiger, J., 2008. Wasserversorgungskonzept für Berlin  und für das von den BWB versorgte Umland (Entwicklung bis 2040) Berlin.</a>",13.26 52.66,52.66,13.26,
883,globalmar_202005_02_MAR_influentsource.fid--6d6ccaee_171ff1a6a80_1c07,466,Wesseling-Hersel,Europe,Germany,50.822,6.993,-9999,-9999,Induced Bank Filtration,Bank filtration,<a href='https://inowas.com/mar-methods/induced-bank-filtration/' target='_blank'>River/lake bank filtration</a><br><a href='https://inowas.com/mar-methods/dune-filtration/' target='_blank'>Dune filtration</a>,River water,Domestic,Water Quality Management,"Furrer, R., Fleig, M., Brauch, H.J., 2000. Wasserförderung und -aufbereitung im Rheineinzugsgebiet. Rheinthemen 2.",6.993 50.822,50.822,6.993,
884,globalmar_202005_02_MAR_influentsource.fid--6d6ccaee_171ff1a6a80_1c08,153,Jinjiang Qu,Asia,China,30.667544,104.092139,1998,-9999,Rainwater and Run-off Harvesting,Rooftop Rainwater Harvesting,<a href='https://inowas.com/mar-methods/rooftop-rainwater-harvesting/' target='_blank'>Rooftop rainwater harvesting</a>,Storm water,Ecological,Maximize Natural Storage,"Wang, Z. 2012. Utilization of urban rainwater in groundwater (in Chinese: 城市雨水在地下水中的利用分析). Groundwater 34 (2): 51–52. doi:1004-1184(2012)02-0051-02.",104.092139 30.667544,0,0,292.5939941
885,globalmar_202005_02_MAR_influentsource.fid--6d6ccaee_171ff1a6a80_1c09,1026,Lake Manatee ASR Wells,North America,USA,27.488002,-82.354684,1983,-9999,"Well, Shaft and Borehole Recharge",Aquifer storage and recovery,<a href='https://inowas.com/mar-methods/aquifer-storage-and-recovery-asr/' target='_blank'>ASR</a>/<a href='https://inowas.com/mar-methods/aquifer-storage-transfer-and-recovery-astr/' target='_blank'>ASTR</a>,Tap water,no data,Maximize Natural Storage,"<a href='http://www.asrforum.com/picturepages/OperASRUS052404.pdf' target='_blank'>Pyne, R. D. G. 2004. Known Operating ASR Systems in the United States (as of May 2004). ASR Systems LLC. http://www.asrforum.com/picturepages/OperASRUS052404.pdf</a>",-82.354684 27.488002,27.488002,-82.354684,413.2106628
886,globalmar_202005_02_MAR_influentsource.fid--6d6ccaee_171ff1a6a80_1c0a,323,Sulaibyia,Asia,Kuwait,29.282019,47.799633,1986,-9999,Spreading Methods,Infiltration basin,<a href='https://inowas.com/mar-methods/infiltration-ponds-and-basins/' target='_blank'>Infiltration ponds</a> (<a href='https://inowas.com/mar-methods/soil-aquifer-treatment-sat/' target='_blank'>SAT</a>),Reclaimed wastewater,no data,Maximize Natural Storage,"<a href='http://www.unesco.org/ulis/cgi-bin/ulis.pl?catno=149210&set=00540C4871_2_193&gp=1&lin=1&ll=1' target='_blank'>Al-Senafy, M., and M. Sherif. 2006. Proposed Scheme for a Natural Soil Treatment System in Kuwait. In Recharge Systems for Protecting a",47.799633 29.282019,29.282019,47.799633,34.03066635
887,globalmar_202005_02_MAR_influentsource.fid--6d6ccaee_171ff1a6a80_1c0b,1102,Montclair Basin,North America,USA,34.087024,-117.702081,2004,-9999,Spreading Methods,Infiltration basin,<a href='https://inowas.com/mar-methods/infiltration-ponds-and-basins/' target='_blank'>Infiltration ponds</a> (<a href='https://inowas.com/mar-methods/soil-aquifer-treatment-sat/' target='_blank'>SAT</a>),Storm water,no data,no data,"<a href='http://www.nwri-usa.org/pdfs/WildermuthPresentationfinal.pdf' target='_blank'>Wildermuth, M., W. Wang, K. Manning, and B. Pak. 2011. Optimization of Supplemental Water Recharge Location and Magnitude to Balance Recharge and Discharge in the Chin",-117.702081 34.087024,0,0,59.77133179
