271,globalmar_202005_02_MAR_influentsource.fid--6d6ccaee_171ff1a6a80_19a3,243,Padipatlabayalu area,Asia,India,13.519922,79.020965,-9999,-9999,In-Channel Modification,Check dam,<a href='https://inowas.com/mar-methods/recharge-dams/' target='_blank'>Recharge dams</a>,River water,no data,Maximize Natural Storage,"Sankaranna, G. 2002. Impact of Water Harvesting Structures on Ground Water Development: A Study from Chittoor District, Andhra Pradesh, India. In Management of Aquifer Recharge for Sustainability: Proceedings of the 4th International Symposium on Artific",79.020965 13.519922,13.519922,79.020965,320.4493408
272,globalmar_202005_02_MAR_influentsource.fid--6d6ccaee_171ff1a6a80_19a4,828,Sítio Várzea Comprida,South America,Brasil,-24.047689,-48.870614,-9999,-9999,In-Channel Modification,Subsurface Dam,<a href='https://inowas.com/mar-methods/subsurface-dams/' target='_blank'>Subsurface dams</a>,River water,Agricultural,Maximize Natural Storage,"<a href='http://ainfo.cnptia.embrapa.br/digital/bitstream/item/69889/1/Avaliacao-da-qualidade-de-agua.pdf' target='_blank'>da Silva, M. S. L., R. da B. V. Parahyba, M. B. de O. Neto, J. B. dos Anjos, T. J. F. Cunha, L. B. Cardoso, and C. L. Mota. 2011. A",-72.918303,0,0,503.1633301
273,globalmar_202005_02_MAR_influentsource.fid--6d6ccaee_171ff1a6a80_19a5,708,Halls Head,Oceania,Australia,-32.540789,115.690477,2005,-9999,Spreading Methods,Infiltration basin,<a href='https://inowas.com/mar-methods/infiltration-ponds-and-basins/' target='_blank'>Infiltration ponds</a> (<a href='https://inowas.com/mar-methods/soil-aquifer-treatment-sat/' target='_blank'>SAT</a>),Reclaimed wastewater,Domestic,Water Quality Management,"Ahuja, S. 2014. Water Reclamation and Sustainability.",115.690477 -32.540789,0,0,
274,globalmar_202005_02_MAR_influentsource.fid--6d6ccaee_171ff1a6a80_19a6,1043,Castle Pines,North America,USA,39.468491,-104.89332,-9999,-9999,"Well, Shaft and Borehole Recharge",Aquifer storage and recovery,<a href='https://inowas.com/mar-methods/aquifer-storage-and-recovery-asr/' target='_blank'>ASR</a>/<a href='https://inowas.com/mar-methods/aquifer-storage-transfer-and-recovery-astr/' target='_blank'>ASTR</a>,no data,no data,no data,"<a href='http://www.asrforum.com/picturepages/OperASRUS052404.pdf' target='_blank'>Pyne, R. D. G. 2004. Known Operating ASR Systems in the United States (as of May 2004). ASR Systems LLC. http://www.asrforum.com/picturepages/OperASRUS052404.pdf</a>",-104.89332 39.468491,0,0,66.26667023
275,globalmar_202005_02_MAR_influentsource.fid--6d6ccaee_171ff1a6a80_19a7,1019,Bay Park Wastewater Treatment Plant,North America,USA,40.632986,-73.664929,1968,1973,Spreading Methods,Infiltration basin,<a href='https://inowas.com/mar-methods/infiltration-ponds-and-basins/' target='_blank'>Infiltration ponds</a> (<a href='https://inowas.com/mar-methods/soil-aquifer-treatment-sat/' target='_blank'>SAT</a>),Reclaimed wastewater,no data,no data,"Bouwer, H., and AWWA Research Foundation, eds. 2008. Design, Operation, and Maintenance for Sustainable Underground Storage Facilities. Denver, Colo. : [London]: Awwa Research Foundation : distributed by American Water Works Association ; distribut",-73.664929 40.632986,40.632986,-73.664929,877.8033447
276,globalmar_202005_02_MAR_influentsource.fid--6d6ccaee_171ff1a6a80_19a8,805,BS-4,South America,Brasil,-6.068088,-37.32788,-9999,-9999,In-Channel Modification,Subsurface Dam,<a href='https://inowas.com/mar-methods/subsurface-dams/' target='_blank'>Subsurface dams</a>,Storm water,Agricultural,Maximize Natural Storage,"Cruz, E. S., D. F. de Freitas, E. P. de C. Cerqueira JR, M. A. Cerqueira, and G. V. L. de Almeida. 2015. Monitoramento da Salinidade do Solo em Barragens Subterrâneas no Semiárido do Rio Grande do Norte. In . Petrolina, Brasil. http://www.ivsmud.com.br",-43.395968,0,0,256.8193359
277,globalmar_202005_02_MAR_influentsource.fid--6d6ccaee_171ff1a6a80_19a9,624,Hardhof,Europe,Switzerland,47.401,8.48,1934,-9999,Induced Bank Filtration,Bank filtration,<a href='https://inowas.com/mar-methods/induced-bank-filtration/' target='_blank'>River/lake bank filtration</a><br><a href='https://inowas.com/mar-methods/dune-filtration/' target='_blank'>Dune filtration</a>,River water,Domestic,Water Quality Management,"Grischek, T., Schoenheinz, D., Worch, E., Hiscock, K., 2002. Bank-Filtration in Europe - An overview of Aquifer Conditions and hydraulic Controls, in: Dillon, P. (Ed.), Management of aquifer recharge for sustainabily, p. p. 488.",8.48 47.401,47.401,8.48,936.0553589
278,globalmar_202005_02_MAR_influentsource.fid--6d6ccaee_171ff1a6a80_19aa,621,Birstal,Europe,Switzerland,47.493,7.591,-9999,-9999,"Well, Shaft and Borehole Recharge",Aquifer storage and recovery,<a href='https://inowas.com/mar-methods/aquifer-storage-and-recovery-asr/' target='_blank'>ASR</a>/<a href='https://inowas.com/mar-methods/aquifer-storage-transfer-and-recovery-astr/' target='_blank'>ASTR</a>,Groundwater,Domestic,no data,"Furrer, R., Fleig, M., Brauch, H.J., 2000. Wasserförderung und -aufbereitung im Rheineinzugsgebiet. Rheinthemen 2.",7.591 47.493,47.493,7.591,583.7360229
279,globalmar_202005_02_MAR_influentsource.fid--6d6ccaee_171ff1a6a80_19ab,262,Biarjomand recharge project,Asia,Iran,36.076362,55.641625,1979,-9999,In-Channel Modification,Check dam,<a href='https://inowas.com/mar-methods/recharge-dams/' target='_blank'>Recharge dams</a>,River water,no data,Physical Aquifer Management,"Kazemi, G. A., H. Mehdizadeh, and R. Ashouri. 2002. Evaluation of Groundwater Recharge Schemes in the Shahood District, Northeast Iran. In Management of Aquifer Recharge for Sustainability: Proceedings of the 4th International Symposium on Artificial Rec",55.641625 36.076362,36.076362,55.641625,108.0546646
280,globalmar_202005_02_MAR_influentsource.fid--6d6ccaee_171ff1a6a80_19ac,469,Witten,Europe,Germany,51.50182,7.893202,1886,-9999,Spreading Methods,Infiltration basin,<a href='https://inowas.com/mar-methods/infiltration-ponds-and-basins/' target='_blank'>Infiltration ponds</a> (<a href='https://inowas.com/mar-methods/soil-aquifer-treatment-sat/' target='_blank'>SAT</a>),River water,Domestic,Water Quality Management,"Furrer, R., Fleig, M., Brauch, H.J., 2000. Wasserförderung und -aufbereitung im Rheineinzugsgebiet. Rheinthemen 2.",7.893202 51.50182,51.50182,7.893202,
281,globalmar_202005_02_MAR_influentsource.fid--6d6ccaee_171ff1a6a80_19ad,605,Hyndevad,Europe,Sweden,59.323,16.45,1915,-9999,Spreading Methods,Infiltration basin,<a href='https://inowas.com/mar-methods/infiltration-ponds-and-basins/' target='_blank'>Infiltration ponds</a> (<a href='https://inowas.com/mar-methods/soil-aquifer-treatment-sat/' target='_blank'>SAT</a>),Lake water,Domestic,Water Quality Management,"Frycklund, C., 2001. Site description Eskilstuna, Sweden, Artificial recharge of groundwater, EC project ENV4-CT95-0071, pp. 30-33.",16.45 59.323,59.323,16.45,
282,globalmar_202005_02_MAR_influentsource.fid--6d6ccaee_171ff1a6a80_19ae,571,Belgrade,Europe,Serbia and Montenegro,44.84321,20.45654,-9999,-9999,Induced Bank Filtration,Bank filtration,<a href='https://inowas.com/mar-methods/induced-bank-filtration/' target='_blank'>River/lake bank filtration</a><br><a href='https://inowas.com/mar-methods/dune-filtration/' target='_blank'>Dune filtration</a>,River water,Domestic,Water Quality Management,"Ray, C., Schubert, J., Melin, G., Linsky, R.B., 2003. Introduction. Kluwer Academic Publishers.",20.45654 44.84321,44.84321,20.45654,299.5826721
283,globalmar_202005_02_MAR_influentsource.fid--6d6ccaee_171ff1a6a80_19af,143,Airport Shanghai,Asia,China,31.154511,121.804596,-9999,-9999,Rainwater and Run-off Harvesting,Rooftop Rainwater Harvesting,<a href='https://inowas.com/mar-methods/rooftop-rainwater-harvesting/' target='_blank'>Rooftop rainwater harvesting</a>,Storm water,no data,Maximize Natural Storage,"Yan, J.-H. 2009. Urban rainwater harvesting and utilization of the Loess Plateau (in Chinese: 黄土高原城市雨水集蓄利用研究). Master thesis, Lanzhou, China: Gansu Agricultural University.",121.804596 31.154511,0,0,380.0379944
284,globalmar_202005_02_MAR_influentsource.fid--6d6ccaee_171ff1a6a80_19b0,880,Sand Hollow Reservoir,North America,USA,37.11278,-113.374061,2002,-9999,Spreading Methods,Infiltration basin,<a href='https://inowas.com/mar-methods/infiltration-ponds-and-basins/' target='_blank'>Infiltration ponds</a> (<a href='https://inowas.com/mar-methods/soil-aquifer-treatment-sat/' target='_blank'>SAT</a>),no data,no data,Physical Aquifer Management,"<a href='https://pubs.usgs.gov/of/2016/1078/ofr20161078.pdf' target='_blank'>Heilweil, V. M., and T. M. Marston. 2011. Assessment of Managed Aquifer Recharge from Sand Hollow Reservoir, Washington County, Utah, Updated to Conditions in 2010. 2011–5142.",-113.374061 37.11278,0,0,59.20199966
285,globalmar_202005_02_MAR_influentsource.fid--6d6ccaee_171ff1a6a80_19b1,281,Yavne-3,Asia,Israel,31.853911,34.713885,-9999,-9999,Spreading Methods,Infiltration basin,<a href='https://inowas.com/mar-methods/infiltration-ponds-and-basins/' target='_blank'>Infiltration ponds</a> (<a href='https://inowas.com/mar-methods/soil-aquifer-treatment-sat/' target='_blank'>SAT</a>),Reclaimed wastewater,Agricultural,Water Quality Management,"<a href='http://www.gsi.gov.il/_uploads/ftp/GsiReport/2009/Goren-Orly-GSI-12-2009.pdf' target='_blank'>Goren, O. 2009. Geochemical Evolution and Manganese Mobilization in Organic Enriched Water Recharging Calcareous-Sandstone Aquifier; Clues from the Sha",34.713885 31.853911,31.853911,34.713885,173.6186676
286,globalmar_202005_02_MAR_influentsource.fid--6d6ccaee_171ff1a6a80_19b2,317,Okseong,Asia,Korea,35.783484,126.833968,1995,-9999,In-Channel Modification,Subsurface Dam,<a href='https://inowas.com/mar-methods/subsurface-dams/' target='_blank'>Subsurface dams</a>,Groundwater,Agricultural,no data,"<a href='https://www.jstage.jst.go.jp/article/jarq/45/1/45_1_51/_pdf/-char/en' target='_blank'>Ishida, S., T. Tsuchihara, S. Yoshimoto, and M. Imaizumi. 2011. Review: Sustainable Use of Groundwater with Underground Dams. JARQ 45 (1): 51 – 61.</a>",126.833968 35.783484,0,0,
287,globalmar_202005_02_MAR_influentsource.fid--6d6ccaee_171ff1a6a80_19b3,170,Farm,Asia,China,47.588685,133.51825,1997,-9999,Spreading Methods,Infiltration basin,<a href='https://inowas.com/mar-methods/infiltration-ponds-and-basins/' target='_blank'>Infiltration ponds</a> (<a href='https://inowas.com/mar-methods/soil-aquifer-treatment-sat/' target='_blank'>SAT</a>),Storm water,Agricultural,Maximize Natural Storage,"Li, H., G. Li, and Y. Liu. 2011. Discussion on the underground reservior in Sanjiang Plain (in Chinese: 论三江平原建设地下水库优势). Heilongjiang Science and Technology of Water Conservancy 3 (39): 157–158. doi:1007-7596(2011)03-0157-02.",133.51825 47.588685,0,0,280.5313416
288,globalmar_202005_02_MAR_influentsource.fid--6d6ccaee_171ff1a6a80_19b4,616,Muttenzer Hard,Europe,Switzerland,47.532,7.7,1955,-9999,Spreading Methods,Surface flooding and ditch-and-furrow,<a href='https://inowas.com/mar-methods/flooding/' target='_blank'>Flooding</a>,River water,Domestic,Water Quality Management,"<a href='https://edoc.unibas.ch/140/1/DissB_6920.pdf' target='_blank'>Rüetschi, D., 2004. BASLER TRINKWASSERGEWINNUNG IN DEN LANGEN ERLEN BIOLOGISCHE REINIGUNGSLEISTUNGEN IN DEN BEWALDETEN WÄSSERSTELLEN  Philosophisch-Naturwissenschaftlichen Fakultät",7.7 47.532,47.532,7.7,583.7360229
289,globalmar_202005_02_MAR_influentsource.fid--6d6ccaee_171ff1a6a80_19b5,858,La atarjea,South America,Peru,-12.041335,-77.014331,2001,-9999,"Well, Shaft and Borehole Recharge",Aquifer storage using wells,<a href='https://inowas.com/mar-methods/shallow-wells-shafts-and-pits-infiltration/' target='_blank'>Shallow well/shaft/pit infiltration</a>,River water,Domestic,Physical Aquifer Management,no data,-89.055666,0,0,152.2146606
290,globalmar_202005_02_MAR_influentsource.fid--6d6ccaee_171ff1a6a80_19b6,902,Paradise Run ASR System,North America,USA,27.21813,-80.960666,-9999,-9999,"Well, Shaft and Borehole Recharge",Aquifer storage and recovery,<a href='https://inowas.com/mar-methods/aquifer-storage-and-recovery-asr/' target='_blank'>ASR</a>/<a href='https://inowas.com/mar-methods/aquifer-storage-transfer-and-recovery-astr/' target='_blank'>ASTR</a>,River water,Ecological,Ecological Benefits,<a href='http://141.232.10.32/pm/projects/project_docs/pdp_asr_combined/052808_asr_report/052808_asr_ch2_asr_eis_main_body_final.pdf' target='_blank'>Final Aquifer Storage and Recovery Pilot Project Technical Data Report - Kissimmee River ASR System - Hi,-80.960666 27.21813,27.21813,-80.960666,413.2106628
291,globalmar_202005_02_MAR_influentsource.fid--6d6ccaee_171ff1a6a80_19b7,447,Petersaue + WW Eich,Europe,Germany,50.01,8.264,-9999,-9999,Induced Bank Filtration,Bank filtration,<a href='https://inowas.com/mar-methods/induced-bank-filtration/' target='_blank'>River/lake bank filtration</a><br><a href='https://inowas.com/mar-methods/dune-filtration/' target='_blank'>Dune filtration</a>,River water,Domestic,no data,"Furrer, R., Fleig, M., Brauch, H.J., 2000. Wasserförderung und -aufbereitung im Rheineinzugsgebiet. Rheinthemen 2.",8.264 50.01,50.01,8.264,346.6159973
292,globalmar_202005_02_MAR_influentsource.fid--6d6ccaee_171ff1a6a80_19b8,560,Mosina-Krajkowo,Europe,Poland,52.21203,16.94246,-9999,-9999,Induced Bank Filtration,Bank filtration,<a href='https://inowas.com/mar-methods/induced-bank-filtration/' target='_blank'>River/lake bank filtration</a><br><a href='https://inowas.com/mar-methods/dune-filtration/' target='_blank'>Dune filtration</a>,River water,Domestic,Water Quality Management,"Górski, J., 2011. Quality of Riverbank Filtrated Water on the Base of Poznań City (Poland) Waterworks Experiences, in: Shamrukh, M. (Ed.), Riverbank Filtration for Water Security in Desert Countries. Springer Netherlands, pp. 269-279.",16.94246 52.21203,52.21203,16.94246,
293,globalmar_202005_02_MAR_influentsource.fid--6d6ccaee_171ff1a6a80_19b9,73,Luohe ASR,Asia,China,34.669067,112.479196,2000,-9999,In-Channel Modification,Check dam,<a href='https://inowas.com/mar-methods/recharge-dams/' target='_blank'>Recharge dams</a>,River water,no data,Maximize Natural Storage,"<a href='http://unesdoc.unesco.org/images/0014/001492/149210e.pdf' target='_blank'>Sun, R., X. Liang, X. Wang, and Q. Liu. 2006. Experience of Capturing Flood Water for Artificial Recharge of Groundwater in North China. In Recharge Systems for Protecting",112.479196 34.669067,0,0,147.5053406
294,globalmar_202005_02_MAR_influentsource.fid--6d6ccaee_171ff1a6a80_19ba,491,Zandvoort,Europe,Netherlands,52.376,4.548,1957,-9999,Spreading Methods,Infiltration basin,<a href='https://inowas.com/mar-methods/infiltration-ponds-and-basins/' target='_blank'>Infiltration ponds</a> (<a href='https://inowas.com/mar-methods/soil-aquifer-treatment-sat/' target='_blank'>SAT</a>),River water,Domestic,Water Quality Management,"Olsthoorn, T.N., Mosch, M.J.M., 2002. Fifty years artificial recharge in the Amsterdam dune area. In: Dillion, P.J. (Ed.), Management of Aquifer Recharge for Sustainability, Proceedings of the fourth International Symposium On Artificial Recharge, ISAR 4",4.548 52.376,52.376,4.548,
295,globalmar_202005_02_MAR_influentsource.fid--6d6ccaee_171ff1a6a80_19bb,885,Delray Beach,North America,USA,26.466666,-80.1,2001,-9999,"Well, Shaft and Borehole Recharge",Aquifer storage and recovery,<a href='https://inowas.com/mar-methods/aquifer-storage-and-recovery-asr/' target='_blank'>ASR</a>/<a href='https://inowas.com/mar-methods/aquifer-storage-transfer-and-recovery-astr/' target='_blank'>ASTR</a>,Reclaimed wastewater,no data,no data,"Mirecki, J. E. 2004. Water-Quality Changes During Cycle Tests at Aquifer Storage Recovery (ASR) Systems of South Florida. ERDC/EL TR-04-8. Vicksburg, MS, USA: Environmental Laboratory, U.S. Army Engineer Research and Development Center.",-80.1 26.466666,26.466666,-80.1,413.2106628
296,globalmar_202005_02_MAR_influentsource.fid--6d6ccaee_171ff1a6a80_19bc,180,Ordos Plateau,Asia,China,40.073906,109.80943,-9999,-9999,Spreading Methods,Infiltration basin,<a href='https://inowas.com/mar-methods/infiltration-ponds-and-basins/' target='_blank'>Infiltration ponds</a> (<a href='https://inowas.com/mar-methods/soil-aquifer-treatment-sat/' target='_blank'>SAT</a>),River water,Agricultural,Maximize Natural Storage,"<a href='https://ac.els-cdn.com/S1878522013002634/1-s2.0-S1878522013002634-main.pdf?_tid=e26cfdbf-e8f4-43ea-bb5e-49da68e1a5b1&acdnat=1523265149_a40401d0897c8734703456d8abbf9f96' target='_blank'>Huang, T., and Z. Pang. 2013. Groundwater Recharge and Dynam",109.80943 40.073906,0,0,56.19466782
297,globalmar_202005_02_MAR_influentsource.fid--6d6ccaee_171ff1a6a80_19bd,1025,Camp Peary,North America,USA,37.309114,-76.644654,1946,1946,"Well, Shaft and Borehole Recharge",Aquifer storage and recovery,<a href='https://inowas.com/mar-methods/aquifer-storage-and-recovery-asr/' target='_blank'>ASR</a>/<a href='https://inowas.com/mar-methods/aquifer-storage-transfer-and-recovery-astr/' target='_blank'>ASTR</a>,no data,no data,no data,"<a href='https://pubs.usgs.gov/pp/0939/report.pdf' target='_blank'>Brown, D. L., and W. D. Silvey. 1977. Artificial Recharge to a Freshwater-Sensitive Brackish-Water Sand Aquifer, Norfolk, Virginia. 939. Geological Survey Professional Paper. Washington,",-76.644654 37.309114,37.309114,-76.644654,466.002655
298,globalmar_202005_02_MAR_influentsource.fid--6d6ccaee_171ff1a6a80_19be,797,Barragem subterrânea do Rio Palhano,South America,Brasil,-4.91667,-38.5167,1990,-9999,In-Channel Modification,Subsurface Dam,<a href='https://inowas.com/mar-methods/subsurface-dams/' target='_blank'>Subsurface dams</a>,River water,Agricultural,Maximize Natural Storage,"<a href='https://scielo.conicyt.cl/pdf/infotec/v22n2/art14.pdf' target='_blank'>Neto, J. W. da S., C. C. Gomes, E. da S. Pitombeira, and R. B. Araújo. 2011. Alternativa de Convivencia con el Problema de la Salinidad del Agua de Irrigación causada por P",-43.43337,0,0,190.2100067
299,globalmar_202005_02_MAR_influentsource.fid--6d6ccaee_171ff1a6a80_19bf,369,Lohiluoma,Europe,Finland,62.54552,22.29675,-9999,-9999,Induced Bank Filtration,Bank filtration,<a href='https://inowas.com/mar-methods/induced-bank-filtration/' target='_blank'>River/lake bank filtration</a><br><a href='https://inowas.com/mar-methods/dune-filtration/' target='_blank'>Dune filtration</a>,River water,Domestic,Water Quality Management,"<a href='https://helda.helsinki.fi/bitstream/handle/10138/38390/SY27_2007_Yhdyskuntien_vedenhankinnan_tulevaisuuden_vaihtoehdot.pdf?sequence=1' target='_blank'>Isomäki, E., Britschgi, R., Gustafsson, J., Kuusisto, E., Munsterhjelm, K., Santala, E., Suok",22.29675 62.54552,62.54552,22.29675,
300,globalmar_202005_02_MAR_influentsource.fid--6d6ccaee_171ff1a6a80_19c0,622,Schaffhausen,Europe,Switzerland,47.693,8.63,-9999,-9999,Induced Bank Filtration,Bank filtration,<a href='https://inowas.com/mar-methods/induced-bank-filtration/' target='_blank'>River/lake bank filtration</a><br><a href='https://inowas.com/mar-methods/dune-filtration/' target='_blank'>Dune filtration</a>,River water,Domestic,no data,"Furrer, R., Fleig, M., Brauch, H.J., 2000. Wasserförderung und -aufbereitung im Rheineinzugsgebiet. Rheinthemen 2.",8.63 47.693,47.693,8.63,936.0553589
301,globalmar_202005_02_MAR_influentsource.fid--6d6ccaee_171ff1a6a80_19c1,878,Talbert Gap Seawater Barrier,North America,USA,33.693905,-117.967179,-9999,-9999,"Well, Shaft and Borehole Recharge",Aquifer storage using wells,<a href='https://inowas.com/mar-methods/shallow-wells-shafts-and-pits-infiltration/' target='_blank'>Shallow well/shaft/pit infiltration</a>,Reclaimed wastewater,no data,Physical Aquifer Management,"<a href='https://www.ocwd.com/media/2414/11-12-annual-recharge-report-final.pdf' target='_blank'>Hutchinson, A. S. 2013. Report on Groundwater Recharge in the Orange County Groundwater Basin 2011-2012. Fountain Valley, CA, USA: Orange County Water Distri",-117.967179 33.693905,0,0,
302,globalmar_202005_02_MAR_influentsource.fid--6d6ccaee_171ff1a6a80_19c2,194,N/A,Asia,China,40.073906,109.80943,2011,-9999,"Well, Shaft and Borehole Recharge",Aquifer storage using wells,<a href='https://inowas.com/mar-methods/shallow-wells-shafts-and-pits-infiltration/' target='_blank'>Shallow well/shaft/pit infiltration</a>,River water,Ecological,Physical Aquifer Management,"Zhang, W., Y. Huan, X. Yu, D. Liu, and J. Zhou. 2015. Multi-Component Transport and Transformation in Deep Confined Aquifer during Groundwater Artificial Recharge. Journal of Environmental Management 152: 109–119. doi:10.1016/j.jenvman.2015.01.027.",109.80943 40.073906,0,0,56.19466782
303,globalmar_202005_02_MAR_influentsource.fid--6d6ccaee_171ff1a6a80_19c3,545,Sint Jansklooster,Europe,Netherlands,52.68,6.009,1936,-9999,Induced Bank Filtration,Bank filtration,<a href='https://inowas.com/mar-methods/induced-bank-filtration/' target='_blank'>River/lake bank filtration</a><br><a href='https://inowas.com/mar-methods/dune-filtration/' target='_blank'>Dune filtration</a>,Lake water,Domestic,Water Quality Management,"Stuyfzand, P.J., Doomen, A., 2004. The Dutch experience with MARS (Managed Aquifer Recharge and Storage) - A review of facilities, techniques and tools.",6.009 52.68,52.68,6.009,
304,globalmar_202005_02_MAR_influentsource.fid--6d6ccaee_171ff1a6a80_19c4,598,river Guadalquivir floodplain,Europe,Spain,37.04,-6.18,1991,-9999,Spreading Methods,Surface flooding and ditch-and-furrow,<a href='https://inowas.com/mar-methods/ditches-and-furrows/' target='_blank'>Ditches and furrows</a>,River water,Agricultural,no data,"Diaz, J.M.M., de la Orden Gomez, J.A., Geta, J.A.L., Campos, J.C.R., Gonzalez-Ramon, A., Machuca, M.M., 2002. Lessons from groundwater recharge projects in Spain in: Dillon, P. (Ed.), International symposium on artificial recharge of groundwater; Managem",-6.18 37.04,37.04,-6.18,233.0533295
305,globalmar_202005_02_MAR_influentsource.fid--6d6ccaee_171ff1a6a80_19c5,1037,Camarillo,North America,USA,34.216016,-119.029333,1979,2014,"Well, Shaft and Borehole Recharge",Aquifer storage and recovery,<a href='https://inowas.com/mar-methods/aquifer-storage-and-recovery-asr/' target='_blank'>ASR</a>/<a href='https://inowas.com/mar-methods/aquifer-storage-transfer-and-recovery-astr/' target='_blank'>ASTR</a>,River water,no data,no data,"<a href='http://www.asrforum.com/picturepages/OperASRUS052404.pdf' target='_blank'>Pyne, R. D. G. 2004. Known Operating ASR Systems in the United States (as of May 2004). ASR Systems LLC. http://www.asrforum.com/picturepages/OperASRUS052404.pdf</a>",-119.029333 34.216016,0,0,60.72733307
306,globalmar_202005_02_MAR_influentsource.fid--6d6ccaee_171ff1a6a80_19c6,371,Forssa,Europe,Finland,60.81368,23.62099,-9999,-9999,Induced Bank Filtration,Bank filtration,<a href='https://inowas.com/mar-methods/induced-bank-filtration/' target='_blank'>River/lake bank filtration</a><br><a href='https://inowas.com/mar-methods/dune-filtration/' target='_blank'>Dune filtration</a>,Lake water,Domestic,Water Quality Management,"Kivimaki, A.-L., 1998. Removal of organic matter during bank filtration- Field studies, pp. 107-112.",23.62099 60.81368,60.81368,23.62099,
307,globalmar_202005_02_MAR_influentsource.fid--6d6ccaee_171ff1a6a80_19c7,807,Conceição (Barragem Comunitária Manoel Cândido Sobrinho),South America,Brasil,-6.81102,-49.270978,-9999,-9999,In-Channel Modification,Subsurface Dam,<a href='https://inowas.com/mar-methods/subsurface-dams/' target='_blank'>Subsurface dams</a>,Storm water,Agricultural,Maximize Natural Storage,"<a href='http://repositorio.ufrn.br:8080/jspui/bitstream/123456789/15972/1/LiciaCAD_DISSERT.pdf' target='_blank'>Dantas, L. C. A. 2009. Avaliação das barragens subterrâneas no regime de um curso d’água na região do semi-árido do RN. Master thesis",-56.081998,0,0,747.1099854
308,globalmar_202005_02_MAR_influentsource.fid--6d6ccaee_171ff1a6a80_19c8,292,Kikai,Asia,Japan,28.321593,129.970904,2009,-9999,In-Channel Modification,Subsurface Dam,<a href='https://inowas.com/mar-methods/subsurface-dams/' target='_blank'>Subsurface dams</a>,Groundwater,Agricultural,Physical Aquifer Management,"<a href='https://www.jstage.jst.go.jp/article/jarq/45/1/45_1_51/_pdf/-char/en' target='_blank'>Ishida, S., T. Tsuchihara, S. Yoshimoto, and M. Imaizumi. 2011. Review: Sustainable Use of Groundwater with Underground Dams. JARQ 45 (1): 51 – 61.</a>",129.970904 28.321593,0,0,
309,globalmar_202005_02_MAR_influentsource.fid--6d6ccaee_171ff1a6a80_19c9,702,Beenyup/Craigie Groundwater Replenishment Trial,Oceania,Australia,-31.7772582,115.7780548,2013,-9999,"Well, Shaft and Borehole Recharge",Aquifer storage and recovery,<a href='https://inowas.com/mar-methods/aquifer-storage-and-recovery-asr/' target='_blank'>ASR</a>/<a href='https://inowas.com/mar-methods/aquifer-storage-transfer-and-recovery-astr/' target='_blank'>ASTR</a>,Reclaimed wastewater,Domestic,Ecological Benefits,"<a href='https://recharge.iah.org/working-groups/clogging-and-its-management' target='_blank'>Johnston, K., M. Martin, and S. Higginson. 2013. Recharge of Potable and Tertiary-Treated Wastewater into a Deep, Confined Sandstone Aquifer in Perth, Western A",115.7780548 -31.7772582,0,0,135.9806671
