544,globalmar_202005_02_MAR_influentsource.fid--6d6ccaee_171ff1a6a80_1ab4,799,Sítio Parque Lagoa do Nado (1 e 2),South America,Brasil,-19.84175,-43.956758,2010,-9999,Rainwater and Run-off Harvesting,Trenches,<a href='https://inowas.com/mar-methods/trenches/' target='_blank'>Trenches</a>,Storm water,Domestic,Physical Aquifer Management,"Caputo, Ú. K., P. M. Moura, N. Oliveira, and I. Aguiar. 2013. Trincheiras de infiltração instaladas em Belo Horizonte–Aspectos operacionais. In Anais do XX Simpósio Brasileiro de Recursos Hídricos. Bento Gonçalves, Brasil. http://www.abrh.org.br/",-63.798508,0,0,408.0066528
545,globalmar_202005_02_MAR_influentsource.fid--6d6ccaee_171ff1a6a80_1ab5,796,Lagoa de Infiltração Cidade Jardim,South America,Brasil,-5.846633,-35.202974,-9999,-9999,Spreading Methods,Infiltration basin,<a href='https://inowas.com/mar-methods/infiltration-ponds-and-basins/' target='_blank'>Infiltration ponds</a> (<a href='https://inowas.com/mar-methods/soil-aquifer-treatment-sat/' target='_blank'>SAT</a>),Storm water,Domestic,Physical Aquifer Management,"<a href='http://repositorio.ufrn.br:8080/jspui/bitstream/123456789/15955/1/LeoneteCAF.pdf' target='_blank'>Ferreira, L. C. de A. 2008. Variação da qualidade da água do escoamento superficial de duas bacias de drenagem de Natal/RN - Brasil. Master thes",-41.049607,0,0,104.8533325
546,globalmar_202005_02_MAR_influentsource.fid--6d6ccaee_171ff1a6a80_1ab6,1151,Wohler Riverbank Filtration site,North America,USA,38.51045,-122.88234,-9999,-9999,Induced Bank Filtration,Bank filtration,<a href='https://inowas.com/mar-methods/induced-bank-filtration/' target='_blank'>River/lake bank filtration</a><br><a href='https://inowas.com/mar-methods/dune-filtration/' target='_blank'>Dune filtration</a>,River water,no data,no data,"<a href='www.soulstatic.com/NATORBF/papers/hubbs/hubbscasehistory.pdf' target='_blank'>Hubbs, S., and T. Caldwell. 2004. Clogging in Louisville presented at the NATO Advanced Research Workshop - Riverbank Filtration Hydrology: Impacts on System Capacity",-122.88234 38.51045,0,0,478.0566711
547,globalmar_202005_02_MAR_influentsource.fid--6d6ccaee_171ff1a6a80_1ab7,546,Sliedrecht,Europe,Netherlands,51.825,4.773,1886,-9999,Induced Bank Filtration,Bank filtration,<a href='https://inowas.com/mar-methods/induced-bank-filtration/' target='_blank'>River/lake bank filtration</a><br><a href='https://inowas.com/mar-methods/dune-filtration/' target='_blank'>Dune filtration</a>,River water,Domestic,Water Quality Management,"Stuyfzand, P.J., Doomen, A., 2004. The Dutch experience with MARS (Managed Aquifer Recharge and Storage) - A review of facilities, techniques and tools.",4.773 51.825,51.825,4.773,477.6199951
548,globalmar_202005_02_MAR_influentsource.fid--6d6ccaee_171ff1a6a80_1ab8,725,Avis Weir (Three Moon Creek),Oceania,Australia,-24.979351,151.123473,1988,-9999,In-Channel Modification,Check dam,<a href='https://inowas.com/mar-methods/recharge-dams/' target='_blank'>Recharge dams</a>,River water,Agricultural,Maximize Natural Storage,<a href='http://www.qca.org.au/Water/Rural/SunWater-s-Irrigation-Prices/Bulk-water-supply-schemes/Three-Moon-Creek/Final-Report/Three-Moon-Creek#finalpos.' target='_blank'>SunWater. 2012. Three Moon Creek Water Supply Scheme. SunWater Irrigation Price Re,151.123473 -24.979351,0,0,156.043335
549,globalmar_202005_02_MAR_influentsource.fid--6d6ccaee_171ff1a6a80_1ab9,957,Bonneville Power Administration,North America,USA,47.922272,-122.097433,1953,-9999,"Well, Shaft and Borehole Recharge",Aquifer storage using wells,<a href='https://inowas.com/mar-methods/shallow-wells-shafts-and-pits-infiltration/' target='_blank'>Shallow well/shaft/pit infiltration</a>,Groundwater,Industrial,Other Benefits,"<a href='http://pubs.er.usgs.gov/publication/wsp1594C?currow=684.' target='_blank'>Price, D., D. H. Hart, and B. L. Foxworthy. 1965. Artificial Recharge in Oregon and Washington 1962. 1594-C. Water Supply Paper. U.S. Geological Survey. http://pubs.er.usg",-122.097433 47.922272,0,0,1097.702026
550,globalmar_202005_02_MAR_influentsource.fid--6d6ccaee_171ff1a6a80_1aba,926,City of Yakima,North America,USA,46.599605,-120.526976,2000,-9999,"Well, Shaft and Borehole Recharge",Aquifer storage and recovery,<a href='https://inowas.com/mar-methods/aquifer-storage-and-recovery-asr/' target='_blank'>ASR</a>/<a href='https://inowas.com/mar-methods/aquifer-storage-transfer-and-recovery-astr/' target='_blank'>ASTR</a>,River water,Domestic,Maximize Natural Storage,"<a href='http://faculty.washington.edu/dersh/Files/Project2009/Aquifer_Presentation.pdf' target='_blank'>Arvan, H., M. Golubovskiy, and K. Wood. 2009. Aquifer Storage and Recovery in Washington. Presentation Washington, D.C. faculty.washington.edu/dersh/",-120.526976 46.599605,0,0,179.7433319
551,globalmar_202005_02_MAR_influentsource.fid--6d6ccaee_171ff1a6a80_1abb,564,Ujecie Polnoc,Europe,Poland,52.23,21.01,1986,-9999,Induced Bank Filtration,Bank filtration,<a href='https://inowas.com/mar-methods/induced-bank-filtration/' target='_blank'>River/lake bank filtration</a><br><a href='https://inowas.com/mar-methods/dune-filtration/' target='_blank'>Dune filtration</a>,Lake water,Domestic,Water Quality Management,"Blazejewski, M., 1983 Perspektywy Wykorzystania Sztucznej Infiltracji W Uzadatnianiu Zanieczyszonych Wod Powierzchniowych W Polsce W Swietle Dotychczasowych Doswiadczen, Sztuczna infiltracja w uzdatnianiu WOD powierzchniowych, pp. 7-12.",21.01 52.23,52.23,21.01,581.2173462
552,globalmar_202005_02_MAR_influentsource.fid--6d6ccaee_171ff1a6a80_1abc,1300,Garzweiler,Europe,Germany,51.17,6.44,1987,-9999,"Well, Shaft and Borehole Recharge",Aquifer storage and recovery,<a href='https://inowas.com/mar-methods/aquifer-storage-and-recovery-asr/' target='_blank'>ASR</a>/<a href='https://inowas.com/mar-methods/aquifer-storage-transfer-and-recovery-astr/' target='_blank'>ASTR</a>,Groundwater,Environmental,Ecological benefits,"<a href='https://www.rwe.com/web/cms/mediablob/de/346066/data/183406/4/rwe/innovation/rohstoffe/braunkohle/renaturierung-und-umweltschutz/wasser-fuer-feuchtgebiete-pdf.pdf' target='_blank'>RWE, na. Ökologie im Nordrevier - Wasser für die Feuchtgebiete",6.44 51.17,51.17,6.44,477.6199951
553,globalmar_202005_02_MAR_influentsource.fid--6d6ccaee_171ff1a6a80_1abd,76,Shanghai NO.21 cotton mill,Asia,China,31.253066,121.523593,1965,-9999,"Well, Shaft and Borehole Recharge",Aquifer storage and recovery,<a href='https://inowas.com/mar-methods/aquifer-storage-and-recovery-asr/' target='_blank'>ASR</a>/<a href='https://inowas.com/mar-methods/aquifer-storage-transfer-and-recovery-astr/' target='_blank'>ASTR</a>,River water,Industrial,Maximize Natural Storage,"Wang, W., and S. Qu. 2011. Problems of Fracture-Karst Aquifer Recharge with Urban Roof Rainwater. In , 932–935. IEEE. doi:10.1109/ISWREP.2011.5893163.",121.523593 31.253066,0,0,399.7593384
554,globalmar_202005_02_MAR_influentsource.fid--6d6ccaee_171ff1a6a80_1abe,751,Nuestra Señora de Fátima,South America,Argentina,-30.35154626,-66.32171631,2007,-9999,In-Channel Modification,Check dam,<a href='https://inowas.com/mar-methods/recharge-dams/' target='_blank'>Recharge dams</a>,Storm water,Agricultural,Other Benefits,no data,-96.67326257,0,0,-12.13066673
555,globalmar_202005_02_MAR_influentsource.fid--6d6ccaee_171ff1a6a80_1abf,1322,Brenta Ramp,Europe,Italy,45.7214,11.6934,2009,-9999,In-Channel Modification,Subsurface Dam,<a href='https://inowas.com/mar-methods/subsurface-dams/' target='_blank'>Subsurface dams</a>,River water,Domestic,Maximize Natural Storage,"<a href='http://www.acquesotterranee.online/index.php/acque/article/view/081-14-0107/45' target='_blank'>Sottani A., Vielmo A. (Italian Journal oh Hydrogeology: 25-29, 2014). Groundwater conservation and monitoring activities in the middle Brenta River p",11.6934 45.7214,45.7214,11.6934,478.7139893
556,globalmar_202005_02_MAR_influentsource.fid--6d6ccaee_171ff1a6a80_1ac0,1095,Pima Mine Road Recharge Project (PMRRP),North America,USA,32.016369,-110.958278,2000,-9999,Spreading Methods,Infiltration basin,<a href='https://inowas.com/mar-methods/infiltration-ponds-and-basins/' target='_blank'>Infiltration ponds</a> (<a href='https://inowas.com/mar-methods/soil-aquifer-treatment-sat/' target='_blank'>SAT</a>),River water,no data,Maximize Natural Storage,<a href='http://www.cap-az.com/index.php/departments/recharge-program/pima-mine-road' target='_blank'>Pima Mine Road Recharge Project (PMRRP). 2015. Central Arizona Project. http://www.cap-az.com/index.php/departments/recharge-program/pima-mine-road (acc,-110.958278 32.016369,0,0,42.61800003
557,globalmar_202005_02_MAR_influentsource.fid--6d6ccaee_171ff1a6a80_1ac1,94,Wang He Zhuang Zi Cun,Asia,China,37.241307,120.172658,2001,-9999,In-Channel Modification,Subsurface Dam,<a href='https://inowas.com/mar-methods/subsurface-dams/' target='_blank'>Subsurface dams</a>,River water,Domestic,Physical Aquifer Management,"Liu, G., C.-X. Ma, B.-X. Zhang, and J.-K. Li. 2004. Groundwater recharge mode and demonstration (in Chinese: 地下水回灌补源模式研究与示范). Water Resources and Hydropower Engineering 35 (2): 57–59.",120.172658 37.241307,0,0,200.5200043
558,globalmar_202005_02_MAR_influentsource.fid--6d6ccaee_171ff1a6a80_1ac2,203,Budhshelly,Asia,India,28.811682,75.578256,1990,-9999,"Well, Shaft and Borehole Recharge",Aquifer storage and recovery,<a href='https://inowas.com/mar-methods/aquifer-storage-and-recovery-asr/' target='_blank'>ASR</a>/<a href='https://inowas.com/mar-methods/aquifer-storage-transfer-and-recovery-astr/' target='_blank'>ASTR</a>,Storm water,Agricultural,Water Quality Management,"Malik, R. S., B. S. Jhorar, R. K. Jhorar, T. Streck, and J. Richter. 2002. Long-Term Successful Operation of Existing Brackish Cavity Wells Far SAR to Improve Quality for Irrigation by Indian Farmers. In Management of Aquifer Recharge for Sustainability:",75.578256 28.811682,28.811682,75.578256,100.7853317
559,globalmar_202005_02_MAR_influentsource.fid--6d6ccaee_171ff1a6a80_1ac3,889,West Well Field,North America,USA,25.739801,-80.461394,-9999,-9999,"Well, Shaft and Borehole Recharge",Aquifer storage and recovery,<a href='https://inowas.com/mar-methods/aquifer-storage-and-recovery-asr/' target='_blank'>ASR</a>/<a href='https://inowas.com/mar-methods/aquifer-storage-transfer-and-recovery-astr/' target='_blank'>ASTR</a>,Groundwater,no data,Maximize Natural Storage,"Mirecki, J. E. 2004. Water-Quality Changes During Cycle Tests at Aquifer Storage Recovery (ASR) Systems of South Florida. ERDC/EL TR-04-8. Vicksburg, MS, USA: Environmental Laboratory, U.S. Army Engineer Research and Development Center.",-80.461394 25.739801,25.739801,-80.461394,
560,globalmar_202005_02_MAR_influentsource.fid--6d6ccaee_171ff1a6a80_1ac4,1040,Diamond Creek well,North America,USA,38.805949,-121.335994,2004,2008,"Well, Shaft and Borehole Recharge",Aquifer storage and recovery,<a href='https://inowas.com/mar-methods/aquifer-storage-and-recovery-asr/' target='_blank'>ASR</a>/<a href='https://inowas.com/mar-methods/aquifer-storage-transfer-and-recovery-astr/' target='_blank'>ASTR</a>,Tap water,Domestic,Maximize Natural Storage,"<a href='http://www.asrforum.com/picturepages/OperASRUS052404.pdf' target='_blank'>Pyne, R. D. G. 2004. Known Operating ASR Systems in the United States (as of May 2004). ASR Systems LLC. http://www.asrforum.com/picturepages/OperASRUS052404.pdf</a>",-121.335994 38.805949,0,0,416.5939941
561,globalmar_202005_02_MAR_influentsource.fid--6d6ccaee_171ff1a6a80_1ac5,1007,Scottsdale Water Campus,North America,USA,33.659395,-111.892772,1999,-9999,"Well, Shaft and Borehole Recharge",Aquifer storage and recovery,<a href='https://inowas.com/mar-methods/aquifer-storage-and-recovery-asr/' target='_blank'>ASR</a>/<a href='https://inowas.com/mar-methods/aquifer-storage-transfer-and-recovery-astr/' target='_blank'>ASTR</a>,Reclaimed wastewater,no data,Physical Aquifer Management,"Bouwer, H., and AWWA Research Foundation, eds. 2008. Design, Operation, and Maintenance for Sustainable Underground Storage Facilities. Denver, Colo. : [London]: Awwa Research Foundation : distributed by American Water Works Association ; distribut",-111.892772 33.659395,0,0,53.51599884
562,globalmar_202005_02_MAR_influentsource.fid--6d6ccaee_171ff1a6a80_1ac6,445,Lübbenau,Europe,Germany,51.868,13.932,-9999,-9999,Induced Bank Filtration,Bank filtration,<a href='https://inowas.com/mar-methods/induced-bank-filtration/' target='_blank'>River/lake bank filtration</a><br><a href='https://inowas.com/mar-methods/dune-filtration/' target='_blank'>Dune filtration</a>,River water,Domestic,Water Quality Management,Personal communication,13.932 51.868,51.868,13.932,
563,globalmar_202005_02_MAR_influentsource.fid--6d6ccaee_171ff1a6a80_1ac7,835,Sítio Santo Antônio – Distrito de Capim,South America,Brasil,-9.8731,-40.23717,-9999,-9999,In-Channel Modification,Subsurface Dam,<a href='https://inowas.com/mar-methods/subsurface-dams/' target='_blank'>Subsurface dams</a>,River water,Agricultural,Maximize Natural Storage,"<a href='http://ainfo.cnptia.embrapa.br/digital/bitstream/CPATSA/36538/1/OPB1522.pdf' target='_blank'>da Silva, M. S. L., C. E. S. Mendonça, J. B. dos Anjos, A. P. M. Honório, A. de S. Silva, and L. T. de L. Brito. 2007. Barragem subterrânea : água",-50.11027,0,0,101.4586639
564,globalmar_202005_02_MAR_influentsource.fid--6d6ccaee_171ff1a6a80_1ac8,1144,Oakes – Small Recharge Test Basin,North America,USA,46.125,-98.093011,1986,1987,Spreading Methods,Infiltration basin,<a href='https://inowas.com/mar-methods/infiltration-ponds-and-basins/' target='_blank'>Infiltration ponds</a> (<a href='https://inowas.com/mar-methods/soil-aquifer-treatment-sat/' target='_blank'>SAT</a>),River water,Agricultural,no data,"<a href='https://pubs.usgs.gov/wri/1989/4122/report.pdf' target='_blank'>Huff, G. F., and J. D. Wald. 1989. Geochemistry of Artificial-Recharge Tests in the Oakes Aquifer near Oakes, Southeastern North Dakota. 89-4122. Water-Resources Investigations Repo",-98.093011 46.125,0,0,165.2466736
565,globalmar_202005_02_MAR_influentsource.fid--6d6ccaee_171ff1a6a80_1ac9,424,Benrath,Europe,Germany,51.16,6.84,1879,-9999,Induced Bank Filtration,Bank filtration,<a href='https://inowas.com/mar-methods/induced-bank-filtration/' target='_blank'>River/lake bank filtration</a><br><a href='https://inowas.com/mar-methods/dune-filtration/' target='_blank'>Dune filtration</a>,River water,Domestic,Water Quality Management,"Hunt, H., Schubert, J., Ray, C., 2003. Operation and Maintenance Considerations, in: Ray, C., Melin, G., Linsky, R. (Eds.), Riverbank Filtration. Springer Netherlands, pp. 61-70.",6.84 51.16,51.16,6.84,
566,globalmar_202005_02_MAR_influentsource.fid--6d6ccaee_171ff1a6a80_1aca,303,Senbaru,Asia,Japan,26.249964,127.763829,-9999,-9999,In-Channel Modification,Subsurface Dam,<a href='https://inowas.com/mar-methods/subsurface-dams/' target='_blank'>Subsurface dams</a>,Groundwater,no data,no data,"Misaki, T., ed. 2004. Chapter 5: Design. In Technical Reference for Effective Groundwater Development, 180–267. Kawasaki, Japan: Japan Green Resources Agency. www.green.go.jp/green/gyoumu/kaigai/manual/groundwater/english/vol05.pdf.",127.763829 26.249964,0,0,
567,globalmar_202005_02_MAR_influentsource.fid--6d6ccaee_171ff1a6a80_1acb,65,Balisha River,Asia,China,40.426251,116.984759,1988,-9999,In-Channel Modification,Subsurface Dam,<a href='https://inowas.com/mar-methods/subsurface-dams/' target='_blank'>Subsurface dams</a>,River water,Agricultural,Physical Aquifer Management,"<a href='http://www.dina-mar.es/pdf/ismar7-proceedingsbook.pdf' target='_blank'>Wang, W., P. Dillon, P. Liu, F. Meng, J. Vanderzalm, B. Liu, S. Qu, and X. Sun. 2012. Effectiveness of Underground Dams in Shandong Peninsula, China. In Achieving Ground Wate",116.984759 40.426251,0,0,81.98867035
568,globalmar_202005_02_MAR_influentsource.fid--6d6ccaee_171ff1a6a80_1acc,1018,East Meadow – basins,North America,USA,40.711222,-73.559328,1982,1984,Spreading Methods,Infiltration basin,<a href='https://inowas.com/mar-methods/infiltration-ponds-and-basins/' target='_blank'>Infiltration ponds</a> (<a href='https://inowas.com/mar-methods/soil-aquifer-treatment-sat/' target='_blank'>SAT</a>),Reclaimed wastewater,Domestic,Physical Aquifer Management,"Bouwer, H., and AWWA Research Foundation, eds. 2008. Design, Operation, and Maintenance for Sustainable Underground Storage Facilities. Denver, Colo. : [London]: Awwa Research Foundation : distributed by American Water Works Association ; distribut",-73.559328 40.711222,40.711222,-73.559328,877.8033447
569,globalmar_202005_02_MAR_influentsource.fid--6d6ccaee_171ff1a6a80_1acd,345,Damascus University Campus,Asia,Syria,33.511274,36.290802,-9999,-9999,"Well, Shaft and Borehole Recharge",Aquifer storage and recovery,<a href='https://inowas.com/mar-methods/aquifer-storage-and-recovery-asr/' target='_blank'>ASR</a>/<a href='https://inowas.com/mar-methods/aquifer-storage-transfer-and-recovery-astr/' target='_blank'>ASTR</a>,River water,Domestic,Maximize Natural Storage,"<a href='http://www.dina-mar.es/pdf/ismar7-proceedingsbook.pdf' target='_blank'>Kattan, Z., N. Kadkoy, and S. Nasser. 2012. Effects of Artificial Recharge Via Injection Wells on Groundwater Quality in a Shallow Alluvial Aquifer, Central Damascus Basin. I",36.290802 33.511274,33.511274,36.290802,38.87133408
570,globalmar_202005_02_MAR_influentsource.fid--6d6ccaee_171ff1a6a80_1ace,206,Darnakambala area,Asia,India,13.545506,79.304971,-9999,-9999,In-Channel Modification,Check dam,<a href='https://inowas.com/mar-methods/recharge-dams/' target='_blank'>Recharge dams</a>,River water,no data,Physical Aquifer Management,"Sankaranna, G. 2002. Impact of Water Harvesting Structures on Ground Water Development: A Study from Chittoor District, Andhra Pradesh, India. In Management of Aquifer Recharge for Sustainability: Proceedings of the 4th International Symposium on Artific",79.304971 13.545506,13.545506,79.304971,311.1099854
571,globalmar_202005_02_MAR_influentsource.fid--6d6ccaee_171ff1a6a80_1acf,77,Shijiazhuang,Asia,China,38.140566,114.512185,2009,-9999,Spreading Methods,Infiltration basin,<a href='https://inowas.com/mar-methods/infiltration-ponds-and-basins/' target='_blank'>Infiltration ponds</a> (<a href='https://inowas.com/mar-methods/soil-aquifer-treatment-sat/' target='_blank'>SAT</a>),River water,no data,no data,"Su, X., W. Xu, and S. Du. 2014. In Situ Infiltration Test Using a Reclaimed Abandoned River Bed: Managed Aquifer Recharge in Shijiazhuang City, China. Environmental Earth Sciences 71 (12): 5017–5025. doi:10.1007/s12665-013-2893-y.",114.512185 38.140566,0,0,101.0559998
572,globalmar_202005_02_MAR_influentsource.fid--6d6ccaee_171ff1a6a80_1ad0,49,Soukra,Africa,Tunisia,36.883,10.25,1965,-9999,Spreading Methods,Surface flooding and ditch-and-furrow,<a href='https://inowas.com/mar-methods/flooding/' target='_blank'>Flooding</a>,Reclaimed wastewater,Agricultural,Physical Aquifer Management,"<a href='http://www.swim-sustain-water.net/fileadmin/resources/conf-_presentations/Tunisian_Experience_in_Artificial_Recharge_using_Treated_Waste_Water.pdf' target='_blank'>Chaieb, H. 2014. Tunisian Experience in Artificial Recharge Using Treated Waste W",10.25 36.883,36.883,10.25,142.8813324
573,globalmar_202005_02_MAR_influentsource.fid--6d6ccaee_171ff1a6a80_1ad1,762,CE Caatinga BS,South America,Brasil,-8.803995,-39.959114,-9999,-9999,In-Channel Modification,Subsurface Dam,<a href='https://inowas.com/mar-methods/subsurface-dams/' target='_blank'>Subsurface dams</a>,River water,Agricultural,Maximize Natural Storage,"<a href='http://revistas.aba-agroecologia.org.br/index.php/rbagroecologia/article/view/7092/5217' target='_blank'>Oliveira, A. K. C. de, M. S. L. da Silva, C. C. E. S. E. S. Mendonça, G. B. Ferreira, V. C. Chaves, and D. J. Silva. 2007. Avaliação qual",-48.763109,0,0,101.4586639
574,globalmar_202005_02_MAR_influentsource.fid--6d6ccaee_171ff1a6a80_1ad2,909,City of Kerrville,North America,USA,30.045765,-99.142412,1998,-9999,"Well, Shaft and Borehole Recharge",Aquifer storage and recovery,<a href='https://inowas.com/mar-methods/aquifer-storage-and-recovery-asr/' target='_blank'>ASR</a>/<a href='https://inowas.com/mar-methods/aquifer-storage-transfer-and-recovery-astr/' target='_blank'>ASTR</a>,River water,Domestic,Maximize Natural Storage,"<a href='http://www.twdb.texas.gov/publications/reports/contracted_reports/doc/0904830940_AquiferStorage.pdf' target='_blank'>TWBD. 2011. An Assessment of Aquifer Storage and Recovery in Texas. 0904830940. Austin, Texas: Texas Water Development Board (TW",-99.142412 30.045765,0,0,241.4633331
575,globalmar_202005_02_MAR_influentsource.fid--6d6ccaee_171ff1a6a80_1ad3,223,Kalwakole,Asia,India,17.12105,78.358502,-9999,-9999,In-Channel Modification,Check dam,<a href='https://inowas.com/mar-methods/recharge-dams/' target='_blank'>Recharge dams</a>,River water,Agricultural,Physical Aquifer Management,"Boisson, A., D. Villesseche, M. Baisset, J. Perrin, M. Viossanges, W. Kloppmann, S. Chandra, et al. 2014. Questioning the Impact and Sustainability of Percolation Tanks as Aquifer Recharge Structures in Semi-Arid Crystalline Context. Environmental Earth",78.358502 17.12105,17.12105,78.358502,256.7446594
576,globalmar_202005_02_MAR_influentsource.fid--6d6ccaee_171ff1a6a80_1ad4,357,Hainburg,Europe,Austria,48.12,16.94,-9999,-9999,Induced Bank Filtration,Bank filtration,<a href='https://inowas.com/mar-methods/induced-bank-filtration/' target='_blank'>River/lake bank filtration</a><br><a href='https://inowas.com/mar-methods/dune-filtration/' target='_blank'>Dune filtration</a>,no data,no data,no data,Personal communication,16.94 48.12,48.12,16.94,316.5213318
577,globalmar_202005_02_MAR_influentsource.fid--6d6ccaee_171ff1a6a80_1ad5,224,Karanampettai,Asia,India,11.017903,77.185017,2004,-9999,In-Channel Modification,Check dam,<a href='https://inowas.com/mar-methods/recharge-dams/' target='_blank'>Recharge dams</a>,River water,Agricultural,Maximize Natural Storage,"<a href='http://unesdoc.unesco.org/images/0014/001492/149210e.pdf' target='_blank'>Palanisami, K., A. Raviraj, B. Jayakumar, S. Gurunathan, T. Arivalagan, and S. Thirumurthi. 2006. Technical Effectiveness of Artificial Recharge Structures in Hard Rock Ar",77.185017 11.017903,11.017903,77.185017,487.2166748
578,globalmar_202005_02_MAR_influentsource.fid--6d6ccaee_171ff1a6a80_1ad6,577,Maribor,Europe,Slovenia,46.5567,15.646,-9999,-9999,Induced Bank Filtration,Bank filtration,<a href='https://inowas.com/mar-methods/induced-bank-filtration/' target='_blank'>River/lake bank filtration</a><br><a href='https://inowas.com/mar-methods/dune-filtration/' target='_blank'>Dune filtration</a>,River water,Domestic,Maximize Natural Storage,"Grischek, T., Schoenheinz, D., Worch, E., Hiscock, K., 2002. Bank-Filtration in Europe - An overview of Aquifer Conditions and hydraulic Controls, in: Dillon, P. (Ed.), Management of aquifer recharge for sustainabily, p. p. 488.",15.646 46.5567,46.5567,15.646,632.2719727
579,globalmar_202005_02_MAR_influentsource.fid--6d6ccaee_171ff1a6a80_1ad7,189,N/A,Asia,China,39.725872,102.620827,2002,-9999,In-Channel Modification,Subsurface Dam,<a href='https://inowas.com/mar-methods/subsurface-dams/' target='_blank'>Subsurface dams</a>,River water,Ecological,Physical Aquifer Management,"Zhou, J., K.-Q. Chen, P. Liang, and X. Su. 2014. Problems and application prospect of ASR technology in the underground reservoir construction of China  (in Chinese: ASR技术模式在我国地下水库工程建设应用中面临的问题与应用展望",102.620827 39.725872,0,0,21.09066582
580,globalmar_202005_02_MAR_influentsource.fid--6d6ccaee_171ff1a6a80_1ad8,1028,Ocotillo ASR Facility,North America,USA,33.256422,-111.89217,2002,-9999,"Well, Shaft and Borehole Recharge",Aquifer storage and recovery,<a href='https://inowas.com/mar-methods/aquifer-storage-and-recovery-asr/' target='_blank'>ASR</a>/<a href='https://inowas.com/mar-methods/aquifer-storage-transfer-and-recovery-astr/' target='_blank'>ASTR</a>,Reclaimed wastewater,no data,no data,"<a href='http://www.asrforum.com/picturepages/OperASRUS052404.pdf' target='_blank'>Pyne, R. D. G. 2004. Known Operating ASR Systems in the United States (as of May 2004). ASR Systems LLC. http://www.asrforum.com/picturepages/OperASRUS052404.pdf</a>",-111.89217 33.256422,0,0,42.06733322
581,globalmar_202005_02_MAR_influentsource.fid--6d6ccaee_171ff1a6a80_1ad9,245,"President Estate , New Delhi",Asia,India,28.616437,77.197286,1996,-9999,Rainwater and Run-off Harvesting,Trenches,<a href='https://inowas.com/mar-methods/trenches/' target='_blank'>Trenches</a>,Storm water,no data,no data,"<a href='http://re.indiaenvironmentportal.org.in/files/Case-studies-RWH-AR-May2011_0.pdf' target='_blank'>Dhiman, S. C., and S. Gupta, eds. 2011. Select Case Studies – Rain Water Harvesting and Artificial Recharge. New Delhi, India: Central Ground Wate",77.197286 28.616437,28.616437,77.197286,261.2086792
582,globalmar_202005_02_MAR_influentsource.fid--6d6ccaee_171ff1a6a80_1ada,710,Yanchep WWTP,Oceania,Australia,-31.5459028,115.646792,2005,-9999,Spreading Methods,Infiltration basin,<a href='https://inowas.com/mar-methods/infiltration-ponds-and-basins/' target='_blank'>Infiltration ponds</a> (<a href='https://inowas.com/mar-methods/soil-aquifer-treatment-sat/' target='_blank'>SAT</a>),Reclaimed wastewater,Domestic,Ecological Benefits,"<a href='http://www.clw.csiro.au/publications/waterforahealthycountry/2010/wfhc-artificial-recharge-potential-perth.pdf' target='_blank'>Smith, A. J., and D. W. Pollock. 2010. Artificial Recharge Potential of the Perth Region Superficial Aquifer: Lake Pr",115.646792 -31.5459028,0,0,
